{
  "$schema": "../.schemas/src/App.tsx.App.schema.json",
  "<img/> Explore Vite": "<img/> 探索 Vite",
  "<img/> Learn more": "<img/> 了解更多",
  "Connect with us": "与我们联系",
  "Count is {count}": "计数为 {count}",
  "Documentation": "文档",
  "Edit <code>src/app.tsx</code> and save to test <code>HMR</code>": "编辑 <code>src/app.tsx</code> 并保存以测试 <code>HMR</code>",
  "Get started": "开始",
  "Join the Vite community": "加入 Vite 社区",
  "Preact logo": "Preact 图标",
  "Vite logo": "Vite 图标",
  "Your questions, answered": "您的问题，已有解答"
}
